full_text,summary
"Penelitian ini bertujuan untuk menganalisis pengaruh penggunaan media pembelajaran berbasis teknologi informasi terhadap hasil belajar siswa di sekolah menengah atas. Latar belakang penelitian ini adalah rendahnya motivasi belajar siswa yang disebabkan oleh metode pembelajaran konvensional yang kurang interaktif. Metode penelitian yang digunakan adalah metode kuasi eksperimen dengan desain pretest-posttest control group design. Populasi dalam penelitian ini adalah seluruh siswa kelas XI SMA Negeri 1 Makassar tahun ajaran 2024/2025 yang berjumlah 320 siswa. Sampel diambil menggunakan teknik purposive sampling sebanyak 64 siswa yang terbagi menjadi dua kelompok yaitu kelompok eksperimen dan kelompok kontrol masing-masing 32 siswa. Instrumen yang digunakan adalah tes hasil belajar berupa soal pilihan ganda sebanyak 30 butir yang telah diuji validitas dan reliabilitasnya. Teknik analisis data menggunakan uji-t independen dengan taraf signifikansi 0,05. Hasil penelitian menunjukkan bahwa rata-rata nilai posttest kelompok eksperimen sebesar 82,5 lebih tinggi dibandingkan kelompok kontrol sebesar 71,3. Hasil uji-t menunjukkan nilai t-hitung sebesar 4,27 lebih besar dari t-tabel sebesar 2,00 dengan nilai signifikansi 0,001 yang lebih kecil dari 0,05. Hal ini menunjukkan bahwa terdapat perbedaan yang signifikan antara hasil belajar siswa yang menggunakan media pembelajaran berbasis teknologi informasi dengan siswa yang menggunakan metode konvensional. Kesimpulan dari penelitian ini adalah penggunaan media pembelajaran berbasis teknologi informasi berpengaruh positif dan signifikan terhadap peningkatan hasil belajar siswa sekolah menengah atas.","Penelitian ini menganalisis pengaruh media pembelajaran berbasis teknologi informasi terhadap hasil belajar siswa SMA. Menggunakan metode kuasi eksperimen dengan 64 siswa SMA Negeri 1 Makassar sebagai sampel. Hasil menunjukkan rata-rata posttest kelompok eksperimen (82,5) lebih tinggi dari kontrol (71,3) dengan nilai t-hitung 4,27 dan signifikansi 0,001. Disimpulkan bahwa media pembelajaran berbasis TI berpengaruh positif dan signifikan terhadap hasil belajar siswa."
"Tujuan penelitian ini adalah untuk merancang dan mengimplementasikan sistem informasi manajemen inventaris barang pada UMKM di Kota Surabaya berbasis web. Permasalahan yang dihadapi UMKM adalah pencatatan stok barang yang masih dilakukan secara manual menggunakan buku catatan sehingga sering terjadi kesalahan pencatatan dan kehilangan data. Penelitian ini menggunakan metode pengembangan perangkat lunak waterfall yang terdiri dari tahap analisis kebutuhan, perancangan sistem, implementasi, dan pengujian. Sistem dikembangkan menggunakan bahasa pemrograman PHP dengan framework Laravel dan basis data MySQL. Perancangan sistem menggunakan Unified Modeling Language meliputi use case diagram, activity diagram, dan class diagram. Fitur utama sistem meliputi manajemen data barang, pencatatan barang masuk dan keluar, perhitungan stok otomatis, laporan inventaris, dan notifikasi stok minimum. Pengujian dilakukan menggunakan metode black box testing terhadap seluruh fungsionalitas sistem. Hasil pengujian menunjukkan bahwa seluruh fungsi berjalan sesuai dengan yang diharapkan dengan tingkat keberhasilan 100 persen. Selain itu dilakukan pengujian usability menggunakan System Usability Scale terhadap 15 pengguna UMKM dan diperoleh skor rata-rata 78,5 yang termasuk dalam kategori acceptable. Sistem informasi manajemen inventaris ini dapat membantu UMKM dalam mengelola stok barang secara efisien dan akurat serta mengurangi risiko kehilangan data.","Penelitian ini merancang sistem informasi manajemen inventaris berbasis web untuk UMKM di Surabaya menggunakan metode waterfall dengan PHP Laravel dan MySQL. Fitur mencakup manajemen barang, pencatatan stok, laporan, dan notifikasi. Pengujian black box menunjukkan keberhasilan 100% dan skor usability SUS 78,5 (acceptable). Sistem ini membantu UMKM mengelola inventaris secara efisien dan akurat."
"Penelitian ini mengkaji implementasi algoritma Naive Bayes dalam klasifikasi sentimen ulasan produk e-commerce berbahasa Indonesia. Data dikumpulkan dari platform Tokopedia berupa 2000 ulasan produk elektronik yang terdiri dari 1000 ulasan positif dan 1000 ulasan negatif. Tahap preprocessing meliputi case folding, tokenisasi, stopword removal menggunakan daftar stopword bahasa Indonesia, dan stemming menggunakan algoritma Nazief-Adriani. Ekstraksi fitur dilakukan menggunakan metode Term Frequency-Inverse Document Frequency untuk mengubah teks menjadi representasi numerik. Dataset dibagi menjadi data latih sebesar 80 persen dan data uji sebesar 20 persen. Model Naive Bayes Multinomial dilatih menggunakan data latih dan dievaluasi menggunakan data uji. Hasil evaluasi menunjukkan bahwa model mencapai akurasi sebesar 87,5 persen dengan nilai precision 86,2 persen untuk kelas positif dan 88,8 persen untuk kelas negatif. Nilai recall yang diperoleh adalah 89,1 persen untuk kelas positif dan 85,9 persen untuk kelas negatif. F1-score rata-rata yang diperoleh adalah 87,4 persen. Confusion matrix menunjukkan bahwa model lebih baik dalam mengidentifikasi ulasan negatif dibandingkan ulasan positif. Hasil penelitian ini menunjukkan bahwa algoritma Naive Bayes efektif digunakan untuk klasifikasi sentimen ulasan produk e-commerce berbahasa Indonesia dengan tingkat akurasi yang cukup tinggi.","Penelitian ini mengimplementasikan algoritma Naive Bayes untuk klasifikasi sentimen 2000 ulasan produk Tokopedia. Preprocessing meliputi case folding, tokenisasi, stopword removal, dan stemming. Fitur diekstraksi menggunakan TF-IDF dengan split data 80:20. Hasil menunjukkan akurasi 87,5%, precision 86,2-88,8%, recall 85,9-89,1%, dan F1-score 87,4%. Naive Bayes terbukti efektif untuk klasifikasi sentimen ulasan e-commerce berbahasa Indonesia."
"Penelitian ini bertujuan untuk menganalisis faktor-faktor yang mempengaruhi keputusan petani dalam mengadopsi teknologi pertanian organik di Kabupaten Malang Jawa Timur. Penelitian dilakukan dengan pendekatan kuantitatif menggunakan metode survei. Populasi penelitian adalah seluruh petani padi di Kecamatan Batu yang berjumlah 450 orang. Sampel penelitian ditentukan menggunakan rumus Slovin dengan margin error 10 persen sehingga diperoleh 82 responden. Data primer dikumpulkan melalui kuesioner terstruktur yang mengukur variabel umur, tingkat pendidikan, luas lahan, pendapatan, akses informasi, dan dukungan pemerintah sebagai variabel independen serta keputusan adopsi teknologi pertanian organik sebagai variabel dependen. Analisis data menggunakan regresi logistik biner karena variabel dependen bersifat dikotomi yaitu mengadopsi atau tidak mengadopsi. Hasil analisis menunjukkan bahwa dari enam variabel yang diuji terdapat tiga variabel yang berpengaruh signifikan terhadap keputusan adopsi yaitu tingkat pendidikan dengan nilai odds ratio 2,34 dan signifikansi 0,008, akses informasi dengan odds ratio 3,12 dan signifikansi 0,002, serta dukungan pemerintah dengan odds ratio 2,87 dan signifikansi 0,004. Sedangkan variabel umur, luas lahan, dan pendapatan tidak berpengaruh signifikan. Model regresi logistik yang dihasilkan mampu mengklasifikasikan dengan benar sebesar 79,3 persen kasus. Kesimpulannya peningkatan akses informasi dan dukungan pemerintah merupakan strategi utama untuk mendorong adopsi pertanian organik di kalangan petani.","Penelitian ini menganalisis faktor adopsi teknologi pertanian organik pada 82 petani di Kabupaten Malang menggunakan regresi logistik biner. Dari enam variabel yang diuji, tiga berpengaruh signifikan: tingkat pendidikan (OR=2,34), akses informasi (OR=3,12), dan dukungan pemerintah (OR=2,87). Model mengklasifikasikan 79,3% kasus dengan benar. Akses informasi dan dukungan pemerintah menjadi strategi utama mendorong adopsi pertanian organik."
"Penelitian ini membahas penerapan metode Fuzzy Analytical Hierarchy Process dalam sistem pendukung keputusan pemilihan lokasi gudang distribusi pada perusahaan logistik di Jakarta. Pemilihan lokasi gudang merupakan keputusan strategis yang melibatkan banyak kriteria dan bersifat kompleks. Kriteria yang digunakan dalam penelitian ini meliputi biaya sewa lokasi, aksesibilitas transportasi, jarak ke pelanggan utama, ketersediaan tenaga kerja, infrastruktur pendukung, dan keamanan lingkungan. Data dikumpulkan melalui wawancara mendalam dengan lima orang pengambil keputusan di perusahaan yang memiliki pengalaman lebih dari sepuluh tahun di bidang logistik. Penilaian perbandingan berpasangan antar kriteria menggunakan skala linguistik fuzzy triangular number. Hasil perhitungan bobot kriteria menunjukkan bahwa aksesibilitas transportasi memiliki bobot tertinggi sebesar 0,248, diikuti oleh jarak ke pelanggan utama sebesar 0,213, biaya sewa sebesar 0,187, infrastruktur pendukung sebesar 0,142, ketersediaan tenaga kerja sebesar 0,118, dan keamanan lingkungan sebesar 0,092. Dari lima alternatif lokasi yang dievaluasi, lokasi di kawasan industri Cakung memperoleh skor tertinggi sebesar 0,312 disusul oleh Cikarang sebesar 0,267 dan Tangerang sebesar 0,198. Consistency ratio yang diperoleh sebesar 0,045 yang lebih kecil dari 0,1 menunjukkan bahwa penilaian para pengambil keputusan bersifat konsisten. Sistem pendukung keputusan dengan metode Fuzzy AHP ini terbukti mampu memberikan rekomendasi pemilihan lokasi gudang yang objektif dan terstruktur.","Penelitian ini menerapkan Fuzzy AHP untuk sistem pendukung keputusan pemilihan lokasi gudang distribusi di Jakarta dengan enam kriteria. Aksesibilitas transportasi memiliki bobot tertinggi (0,248). Dari lima alternatif, kawasan industri Cakung memperoleh skor tertinggi (0,312). Consistency ratio 0,045 menunjukkan penilaian konsisten. Metode Fuzzy AHP terbukti memberikan rekomendasi pemilihan lokasi yang objektif dan terstruktur."
